{
  "artifact": "VALIDATION_RESULT",
  "schema_version": "fitflow-validation-result/v2",
  "task_id": "FF-AI-VNEXT-003",
  "run_id": "FF-AI-VNEXT-003-20260818",
  "created_at": "2026-08-18T17:00:00-03:00",
  "baseline": {
    "revision": "44952257482192c438cb38f80be623056fce2409",
    "fingerprint_status": "unavailable",
    "working_tree_fingerprint": null,
    "fingerprint_reason": "El arbol contiene cambios de la migracion vNext en curso; no se capturo un fingerprint antes de la tarea."
  },
  "status": "PASS",
  "gates": [
    {
      "gate_id": "contract",
      "command": "node --test tests/contract/contracts.test.js",
      "cwd": "FitFlow-ai",
      "status": "PASS",
      "exit_code": 0,
      "duration_ms": 300,
      "summary": "8 tests PASS (common, task, run-event, run-state, validation)",
      "output_artifact": null
    },
    {
      "gate_id": "registries",
      "command": "node --test tests/contract/registries.test.js",
      "cwd": "FitFlow-ai",
      "status": "PASS",
      "exit_code": 0,
      "duration_ms": 400,
      "summary": "8 tests PASS contra configuracion real de ../.ai/config",
      "output_artifact": null
    },
    {
      "gate_id": "deps",
      "command": "node -e \"require('zod'); require('yaml')\"",
      "cwd": "FitFlow-ai",
      "status": "PASS",
      "exit_code": 0,
      "duration_ms": 200,
      "summary": "zod@4 y yaml@2 resolubles desde FitFlow-ai",
      "output_artifact": null
    }
  ],
  "next_state": "REVIEWING"
}