{
  "artifact": "VALIDATION_RESULT",
  "schema_version": "fitflow-validation-result/v2",
  "task_id": "FF-AI-VNEXT-004",
  "run_id": "FF-AI-VNEXT-004-20260818",
  "created_at": "2026-08-18T18:20:00-03:00",
  "baseline": {
    "revision": "44952257482192c438cb38f80be623056fce2409",
    "fingerprint_status": "unavailable",
    "working_tree_fingerprint": null,
    "fingerprint_reason": "El arbol contiene cambios de la migracion vNext en curso; no se capturo un fingerprint antes de la tarea."
  },
  "status": "PASS",
  "gates": [
    {
      "gate_id": "core",
      "command": "node --test tests/core/state-machine.test.js",
      "cwd": "FitFlow-ai",
      "status": "PASS",
      "exit_code": 0,
      "duration_ms": 600,
      "summary": "8 tests PASS: state machine (4) y run store sqlite (4)",
      "output_artifact": null
    },
    {
      "gate_id": "orchestrator",
      "command": "node -e \"const {createStateMachineFromOrchestrator}=require('./src/core/state-machine'); const {loadRegistryFile}=require('./src/registries'); const sm=createStateMachineFromOrchestrator(loadRegistryFile('orchestrator.yaml')); if(!sm.canTransition('PENDING_ACCEPTANCE','DONE','developer')) process.exit(1); console.log('orchestrator OK', sm.states.size, 'estados')\"",
      "cwd": "FitFlow-ai",
      "status": "PASS",
      "exit_code": 0,
      "duration_ms": 300,
      "summary": "State Machine gobernada por orchestrator.yaml real; 15 estados",
      "output_artifact": null
    }
  ],
  "next_state": "REVIEWING"
}